{
  "schemaVersion": "api-contract/v2",
  "openapi": "3.1.0",
  "info": {
    "title": "Reference AI Conversation API",
    "version": "1.0.0",
    "description": "Authenticated project-scoped API for durable conversations, model runs, resumable typed events, cancellation, and retry."
  },
  "paths": {
    "/api/v1/conversations": {
      "get": {
        "operationId": "listConversations",
        "summary": "List project conversations",
        "security": [{"SessionAuth": []}],
        "responses": {
          "200": {"description": "Project conversations", "content": {"application/json": {"schema": {"type": "array", "items": {"$ref": "#/components/schemas/Conversation"}}}}},
          "401": {"$ref": "#/components/responses/Error"},
          "403": {"$ref": "#/components/responses/Error"}
        }
      },
      "post": {
        "operationId": "createConversation",
        "summary": "Create a project conversation",
        "security": [{"SessionAuth": []}],
        "parameters": [{"name": "Idempotency-Key", "in": "header", "required": true, "schema": {"type": "string", "minLength": 1, "maxLength": 200}}],
        "requestBody": {"required": true, "content": {"application/json": {"schema": {"$ref": "#/components/schemas/CreateConversationRequest"}}}},
        "responses": {
          "201": {"description": "Conversation created", "content": {"application/json": {"schema": {"$ref": "#/components/schemas/Conversation"}}}},
          "401": {"$ref": "#/components/responses/Error"},
          "403": {"$ref": "#/components/responses/Error"},
          "409": {"$ref": "#/components/responses/Error"},
          "429": {"$ref": "#/components/responses/Error"}
        }
      }
    },
    "/api/v1/conversations/{conversationId}": {
      "parameters": [{"name": "conversationId", "in": "path", "required": true, "schema": {"type": "string", "format": "uuid"}}],
      "get": {
        "operationId": "getConversation",
        "summary": "Get a project conversation",
        "security": [{"SessionAuth": []}],
        "responses": {
          "200": {"description": "Conversation", "content": {"application/json": {"schema": {"$ref": "#/components/schemas/Conversation"}}}},
          "401": {"$ref": "#/components/responses/Error"},
          "404": {"$ref": "#/components/responses/Error"}
        }
      }
    },
    "/api/v1/conversations/{conversationId}/messages": {
      "parameters": [{"name": "conversationId", "in": "path", "required": true, "schema": {"type": "string", "format": "uuid"}}],
      "get": {
        "operationId": "listMessages",
        "summary": "List durable messages",
        "security": [{"SessionAuth": []}],
        "responses": {
          "200": {"description": "Messages", "content": {"application/json": {"schema": {"type": "array", "items": {"$ref": "#/components/schemas/Message"}}}}},
          "401": {"$ref": "#/components/responses/Error"},
          "404": {"$ref": "#/components/responses/Error"}
        }
      },
      "post": {
        "operationId": "sendMessage",
        "summary": "Persist a user message",
        "security": [{"SessionAuth": []}],
        "parameters": [{"name": "Idempotency-Key", "in": "header", "required": true, "schema": {"type": "string", "minLength": 1, "maxLength": 200}}],
        "requestBody": {"required": true, "content": {"application/json": {"schema": {"$ref": "#/components/schemas/SendMessageRequest"}}}},
        "responses": {
          "201": {"description": "Message persisted", "content": {"application/json": {"schema": {"$ref": "#/components/schemas/Message"}}}},
          "401": {"$ref": "#/components/responses/Error"},
          "404": {"$ref": "#/components/responses/Error"},
          "409": {"$ref": "#/components/responses/Error"},
          "429": {"$ref": "#/components/responses/Error"}
        }
      }
    },
    "/api/v1/conversations/{conversationId}/runs": {
      "parameters": [{"name": "conversationId", "in": "path", "required": true, "schema": {"type": "string", "format": "uuid"}}],
      "get": {
        "operationId": "listRuns",
        "summary": "List durable runs",
        "security": [{"SessionAuth": []}],
        "responses": {
          "200": {"description": "Runs", "content": {"application/json": {"schema": {"type": "array", "items": {"$ref": "#/components/schemas/Run"}}}}},
          "401": {"$ref": "#/components/responses/Error"},
          "404": {"$ref": "#/components/responses/Error"}
        }
      },
      "post": {
        "operationId": "createRun",
        "summary": "Create an idempotent model run",
        "security": [{"SessionAuth": []}],
        "parameters": [{"name": "Idempotency-Key", "in": "header", "required": true, "schema": {"type": "string", "minLength": 1, "maxLength": 200}}],
        "requestBody": {"required": true, "content": {"application/json": {"schema": {"$ref": "#/components/schemas/CreateRunRequest"}}}},
        "responses": {
          "202": {"description": "Run queued", "content": {"application/json": {"schema": {"$ref": "#/components/schemas/Run"}}}},
          "401": {"$ref": "#/components/responses/Error"},
          "404": {"$ref": "#/components/responses/Error"},
          "409": {"$ref": "#/components/responses/Error"},
          "429": {"$ref": "#/components/responses/Error"}
        }
      }
    },
    "/api/v1/conversations/{conversationId}/runs/{runId}": {
      "parameters": [
        {"name": "conversationId", "in": "path", "required": true, "schema": {"type": "string", "format": "uuid"}},
        {"name": "runId", "in": "path", "required": true, "schema": {"type": "string", "format": "uuid"}}
      ],
      "get": {
        "operationId": "getRun",
        "summary": "Get a durable run",
        "security": [{"SessionAuth": []}],
        "responses": {
          "200": {"description": "Run", "content": {"application/json": {"schema": {"$ref": "#/components/schemas/Run"}}}},
          "401": {"$ref": "#/components/responses/Error"},
          "404": {"$ref": "#/components/responses/Error"}
        }
      }
    },
    "/api/v1/conversations/{conversationId}/runs/{runId}/events": {
      "parameters": [
        {"name": "conversationId", "in": "path", "required": true, "schema": {"type": "string", "format": "uuid"}},
        {"name": "runId", "in": "path", "required": true, "schema": {"type": "string", "format": "uuid"}},
        {"name": "Last-Event-ID", "in": "header", "required": false, "schema": {"type": "integer", "minimum": 0}}
      ],
      "get": {
        "operationId": "streamRunEvents",
        "summary": "Stream typed durable run events",
        "security": [{"SessionAuth": []}],
        "responses": {
          "200": {"description": "Resumable SSE stream", "headers": {"Cache-Control": {"schema": {"const": "no-cache"}}}, "content": {"text/event-stream": {"schema": {"$ref": "#/components/schemas/RunEvent"}}}},
          "401": {"$ref": "#/components/responses/Error"},
          "404": {"$ref": "#/components/responses/Error"},
          "410": {"$ref": "#/components/responses/Error"},
          "429": {"$ref": "#/components/responses/Error"}
        }
      }
    },
    "/api/v1/conversations/{conversationId}/runs/{runId}/cancel": {
      "parameters": [
        {"name": "conversationId", "in": "path", "required": true, "schema": {"type": "string", "format": "uuid"}},
        {"name": "runId", "in": "path", "required": true, "schema": {"type": "string", "format": "uuid"}}
      ],
      "post": {
        "operationId": "cancelRun",
        "summary": "Idempotently cancel a run",
        "security": [{"SessionAuth": []}],
        "parameters": [{"name": "Idempotency-Key", "in": "header", "required": true, "schema": {"type": "string", "minLength": 1, "maxLength": 200}}],
        "responses": {
          "202": {"description": "Cancellation requested", "content": {"application/json": {"schema": {"$ref": "#/components/schemas/Run"}}}},
          "401": {"$ref": "#/components/responses/Error"},
          "404": {"$ref": "#/components/responses/Error"},
          "409": {"$ref": "#/components/responses/Error"}
        }
      }
    },
    "/api/v1/conversations/{conversationId}/runs/{runId}/retry": {
      "parameters": [
        {"name": "conversationId", "in": "path", "required": true, "schema": {"type": "string", "format": "uuid"}},
        {"name": "runId", "in": "path", "required": true, "schema": {"type": "string", "format": "uuid"}}
      ],
      "post": {
        "operationId": "retryRun",
        "summary": "Retry a run with an explicit reason",
        "security": [{"SessionAuth": []}],
        "parameters": [{"name": "Idempotency-Key", "in": "header", "required": true, "schema": {"type": "string", "minLength": 1, "maxLength": 200}}],
        "requestBody": {"required": true, "content": {"application/json": {"schema": {"$ref": "#/components/schemas/RetryRunRequest"}}}},
        "responses": {
          "202": {"description": "Retry queued", "content": {"application/json": {"schema": {"$ref": "#/components/schemas/Run"}}}},
          "400": {"$ref": "#/components/responses/Error"},
          "401": {"$ref": "#/components/responses/Error"},
          "404": {"$ref": "#/components/responses/Error"},
          "409": {"$ref": "#/components/responses/Error"},
          "429": {"$ref": "#/components/responses/Error"}
        }
      }
    }
  },
  "components": {
    "securitySchemes": {
      "SessionAuth": {"type": "apiKey", "in": "cookie", "name": "session"}
    },
    "responses": {
      "Error": {
        "description": "Stable error envelope",
        "content": {
          "application/json": {
            "schema": {"$ref": "#/components/schemas/Error"}
          }
        }
      }
    },
    "schemas": {